{
  "topic": "How to give feedback that changes behaviour, not just feelings",
  "scope_note": "Practical guidance for rewriting ordinary workplace feedback between colleagues, including peers. The sequence below is a conservative writing aid, not a validated intervention or a promise of effectiveness. The running situation and all dialogue are explicitly hypothetical. Formal performance, disciplinary and safety procedures are outside scope.",
  "facts": [
    {
      "id": "F1",
      "statement": "For behaviour-focused feedback, identify what you want the colleague to do differently in a relevant future situation.",
      "kind": "practice",
      "confidence": "mainstream",
      "numbers": [],
      "terms": [
        "desired behaviour"
      ],
      "caveat": "This is a planning recommendation, not a guarantee that the colleague will agree or act."
    },
    {
      "id": "F2",
      "statement": "An emotional reaction to feedback is not, by itself, evidence of a change in workplace behaviour.",
      "kind": "caution",
      "confidence": "established",
      "numbers": [],
      "terms": [
        "emotional reaction",
        "behaviour change"
      ]
    },
    {
      "id": "F3",
      "statement": "How feedback is delivered can affect the recipient's willingness to discuss it.",
      "kind": "finding",
      "confidence": "mainstream",
      "numbers": [],
      "caveat": "Responses depend on the person, relationship and context; respectful wording cannot ensure receptiveness."
    },
    {
      "id": "F4",
      "statement": "Describe a specific action or omission rather than using a broad judgement about the colleague's character.",
      "kind": "practice",
      "confidence": "mainstream",
      "numbers": [],
      "terms": [
        "observation"
      ],
      "caveat": "This helps specify the subject of the feedback; it does not make the giver's interpretation automatically correct."
    },
    {
      "id": "F5",
      "statement": "Identify the situation in which the action or omission occurred.",
      "kind": "practice",
      "confidence": "mainstream",
      "numbers": [],
      "terms": [
        "situation"
      ],
      "caveat": "Use an example you can substantiate rather than presenting a hypothetical event as an observation."
    },
    {
      "id": "F6",
      "statement": "Explain the relevant work consequence without presenting an inferred motive as a fact.",
      "kind": "practice",
      "confidence": "mainstream",
      "numbers": [],
      "terms": [
        "work consequence"
      ],
      "caveat": "If the consequence is uncertain, describe it as a concern or possibility rather than an established result."
    },
    {
      "id": "F7",
      "statement": "Phrase the requested change as an action the colleague can recognise and attempt.",
      "kind": "practice",
      "confidence": "mainstream",
      "numbers": [],
      "terms": [
        "requested action"
      ],
      "caveat": "A clear request can still be infeasible or inappropriate in the colleague's circumstances."
    },
    {
      "id": "F8",
      "statement": "Invite the colleague's account of the situation before treating your proposed solution as settled.",
      "kind": "practice",
      "confidence": "mainstream",
      "numbers": [],
      "caveat": "Their account may reveal missing context; discussion need not produce agreement."
    },
    {
      "id": "F9",
      "statement": "Discuss a next action with a clear occasion for carrying it out.",
      "kind": "practice",
      "confidence": "mainstream",
      "numbers": [],
      "terms": [
        "next action"
      ],
      "caveat": "A request is not an agreement until the recipient has actually agreed."
    },
    {
      "id": "F10",
      "statement": "A follow-up can check whether the intended action occurred.",
      "kind": "practice",
      "confidence": "mainstream",
      "numbers": [],
      "terms": [
        "follow-up"
      ],
      "caveat": "Observed follow-through does not by itself establish that feedback caused the change."
    },
    {
      "id": "F11",
      "statement": "Feedback alone cannot guarantee another person's behaviour change.",
      "kind": "caution",
      "confidence": "established",
      "numbers": []
    },
    {
      "id": "F12",
      "statement": "Missing resources, authority or skills can limit a colleague's ability to carry out a requested change.",
      "kind": "caution",
      "confidence": "mainstream",
      "numbers": [],
      "caveat": "Do not assume which constraint applies without exploring the situation."
    },
    {
      "id": "F13",
      "statement": "For ordinary peer feedback, frame the proposed change as a request rather than assuming managerial authority.",
      "kind": "practice",
      "confidence": "mainstream",
      "numbers": [],
      "caveat": "Role responsibilities and organisational procedures vary; this sheet does not establish the giver's authority."
    },
    {
      "id": "F14",
      "statement": "Imagine a colleague sending a shared project update without noting a changed delivery date.",
      "kind": "example",
      "confidence": "established",
      "numbers": [],
      "terms": [
        "shared project update"
      ],
      "caveat": "This is an invented workplace situation, not an observed event or an organisational rule."
    },
    {
      "id": "F15",
      "statement": "In that hypothetical situation, imagine that you used the old date when planning your work.",
      "kind": "example",
      "confidence": "established",
      "numbers": [],
      "caveat": "This consequence is stipulated for the example, not offered as a research finding."
    },
    {
      "id": "F16",
      "statement": "In the hypothetical exchange, the wording 'Please be more considerate' does not specify what to do differently in the next project update.",
      "kind": "example",
      "confidence": "established",
      "numbers": [],
      "caveat": "This invented wording is assessed for action clarity, not for the recipient's likely feelings or intentions."
    },
    {
      "id": "F17",
      "statement": "A hypothetical revision is: 'In the last project update, the changed delivery date was not noted. I used the old date to plan my work. For the next update, could you flag any changed delivery date in the message?'",
      "kind": "example",
      "confidence": "established",
      "numbers": [],
      "caveat": "This is invented dialogue using the stipulated situation and consequence; it is not a universal script."
    },
    {
      "id": "F18",
      "statement": "The hypothetical revision identifies flagging a changed delivery date in the next update as the requested action.",
      "kind": "example",
      "confidence": "established",
      "numbers": [],
      "caveat": "The wording makes the request explicit but does not establish agreement, feasibility or subsequent behaviour."
    },
    {
      "id": "F19",
      "statement": "A useful clarity check is whether the recipient can identify what action is requested and when it applies from the wording.",
      "kind": "practice",
      "confidence": "mainstream",
      "numbers": [],
      "terms": [
        "clarity check"
      ],
      "caveat": "This is a writing criterion, not a validated measure of feedback effectiveness; the revision meets it more clearly than 'Please be more considerate'."
    },
    {
      "id": "F20",
      "statement": "In the hypothetical exchange, a possible discussion prompt is: 'Would that work for you, or is there a constraint we should account for?'",
      "kind": "example",
      "confidence": "established",
      "numbers": [],
      "caveat": "This invented prompt invites the colleague's perspective without inventing their response or promising agreement."
    }
  ],
  "not_claimed": [
    "Clear feedback reliably produces behaviour change.",
    "A positive, negative or absent emotional reaction proves whether feedback worked.",
    "Feelings are irrelevant to workplace feedback.",
    "A colleague's behaviour reveals their motive or character.",
    "Specific wording removes power differences or makes every request reasonable.",
    "The writing sequence in this sheet is a validated or universally superior feedback model.",
    "A feedback sandwich or any other classic approach is always effective or always ineffective; this sheet does not compare approaches.",
    "The hypothetical colleague agrees, feels a particular emotion or changes their behaviour.",
    "People learn best when instruction is matched to a learning-style category.",
    "Fixed retention percentages by presentation modality are established facts.",
    "More animation or interactivity always improves learning."
  ],
  "review": {
    "status": "approved",
    "by": "agent, unattended bench (topic mode)",
    "note": "Prepared as conservative subject-matter guidance for human review. No external sources, organisational policies, role permissions or empirical effect sizes were verified. Practice recommendations are not claims of proven causal effectiveness. The peer situation is an editorial choice; any preferred organisational method remains unverified. No finding supports preferring cartoon acting over a classic explanation-led presentation; both remain available."
  }
}
