{
  "topic": "Spaced retrieval practice: how to keep a newly learned work skill from fading (topic chosen by the knowledge writer because none was supplied; the human must confirm or replace it)",
  "scope_note": "Only the core idea: revisit new material in spaced, effortful recall attempts instead of one block. No learning-styles claims, no percentages, no brain-science mechanisms beyond what is stated.",
  "facts": [
    {
      "id": "F1",
      "statement": "Memory for newly learned material fades over time when it is not used or revisited.",
      "kind": "finding",
      "confidence": "established",
      "reference_hint": "Ebbinghaus, work on memory and forgetting (1885)"
    },
    {
      "id": "F2",
      "statement": "Forgetting is fastest soon after learning and slows down as time passes.",
      "kind": "finding",
      "confidence": "established",
      "reference_hint": "Ebbinghaus (1885), the forgetting curve; shape replicated in later work",
      "caveat": "The exact rate varies with the material, the person and how well it was learned, so the lesson should describe the shape and give no figures."
    },
    {
      "id": "F3",
      "statement": "The spacing effect: practice spread over several sessions with gaps usually leads to better long-term retention than the same amount of practice in one block.",
      "kind": "finding",
      "confidence": "established",
      "reference_hint": "Cepeda and colleagues, review of spacing studies (2006)",
      "caveat": "Best gap length depends on how long the person needs to remember; say 'usually' and give no ideal gap."
    },
    {
      "id": "F4",
      "statement": "Cramming in one block can feel productive and can help for a test soon after, but it tends to fade faster.",
      "kind": "finding",
      "confidence": "mainstream",
      "caveat": "Cramming does work for very short-term needs; the claim is about lasting retention."
    },
    {
      "id": "F5",
      "statement": "Retrieval practice means trying to recall something from memory without looking at it, such as answering a question or doing the task from memory.",
      "kind": "definition",
      "confidence": "established",
      "terms": [
        "retrieval practice"
      ]
    },
    {
      "id": "F6",
      "statement": "Trying to recall material usually strengthens later memory more than simply re-reading or re-watching it.",
      "kind": "finding",
      "confidence": "established",
      "reference_hint": "Roediger and Karpicke (2006), the testing effect",
      "caveat": "Effect is strongest when recall is attempted before checking the answer; feedback afterwards helps."
    },
    {
      "id": "F7",
      "statement": "Re-reading or re-watching material can feel familiar and easy, and that feeling of familiarity can be mistaken for knowing it.",
      "kind": "mechanism",
      "confidence": "mainstream",
      "caveat": "Describes a common pattern, not every learner in every case."
    },
    {
      "id": "F8",
      "statement": "Recall attempts that feel somewhat hard, even when some answers are wrong or missed, tend to help learning more than ones that feel effortless.",
      "kind": "finding",
      "confidence": "mainstream",
      "caveat": "Difficulty must stay manageable; impossible tasks without feedback do not help. Often called 'desirable difficulty'.",
      "terms": [
        "desirable difficulty"
      ]
    },
    {
      "id": "F9",
      "statement": "A practical step: after learning a new work skill, close the material, try to do it or explain it from memory, then check what you missed.",
      "kind": "practice",
      "confidence": "mainstream",
      "caveat": "A sensible application of the research above rather than a single tested recipe."
    },
    {
      "id": "F10",
      "statement": "A practical step: repeat that short recall attempt on later days, with gaps between attempts, rather than all at once.",
      "kind": "practice",
      "confidence": "mainstream",
      "caveat": "Exact timing is not fixed by the research; any spaced schedule beats none for lasting retention, usually."
    },
    {
      "id": "F11",
      "statement": "Short recall attempts can be tied to work that already happens, such as using the new tool on a real task a few days after training.",
      "kind": "practice",
      "confidence": "mainstream",
      "caveat": "Suggested way to make the habit low effort; not itself a studied claim."
    },
    {
      "id": "F12",
      "statement": "A single training session with no follow-up leaves most of the later remembering to chance.",
      "kind": "caution",
      "confidence": "mainstream",
      "caveat": "Use as a plain-language summary of F1 to F3; do not turn it into a percentage."
    }
  ],
  "not_claimed": [
    "Any specific percentage of training forgotten after a set time (such figures circulate without a reliable source)",
    "People have learning styles (visual, auditory, kinesthetic) and learn better when taught in their style",
    "We only use ten percent of our brains",
    "Learners remember fixed percentages of what they read, hear or do (the 'learning pyramid')",
    "There is one ideal gap between practice sessions that works for everyone",
    "Cramming never works",
    "Quotes attributed to named people about learning that were not checked"
  ],
  "review": {
    "status": "approved",
    "by": "agent, unattended bench (topic mode)",
    "note": "No topic was supplied. The writer chose spaced retrieval practice as a conservative default. Reference hints are from memory and were not verified against sources; a human should confirm the topic and check the hints before approval. Suggested running situation (not a fact): a colleague trained on new software who struggles a week later."
  }
}
