{
  "topic": "How to give feedback that changes behaviour, not just feelings",
  "scope_note": "Giving feedback to a peer or report about a specific piece of work or conduct. Three parts: observed action, effect, next step. No statistics, no learning-styles claims, no named-study claims.",
  "facts": [
    {
      "id": "F1",
      "statement": "Feedback is information given to a person about something they did, so that they can keep it or change it.",
      "kind": "definition",
      "confidence": "established",
      "terms": [
        "feedback"
      ]
    },
    {
      "id": "F2",
      "statement": "General praise or general criticism, such as 'good job' or 'that was weak', tells the person how you feel but not what to repeat or change.",
      "kind": "mechanism",
      "confidence": "established"
    },
    {
      "id": "F3",
      "statement": "A comment that describes the person, such as 'you are a natural presenter' or 'you are disorganised', gives the receiver nothing specific to act on.",
      "kind": "mechanism",
      "confidence": "mainstream",
      "caveat": "This is widely taught practice and consistent with research on task-focused feedback; say it as practical guidance, not as a proven law."
    },
    {
      "id": "F4",
      "statement": "Feedback about a specific action, what the person did or said, is something the receiver can see, recall and do differently.",
      "kind": "practice",
      "confidence": "mainstream",
      "caveat": "Presented as good practice that is broadly supported, not a guarantee that behaviour will change."
    },
    {
      "id": "F5",
      "statement": "A useful description of an action sticks to what an observer could see or hear, such as 'you read the slides aloud for most of the talk', and leaves out guesses about motives or character.",
      "kind": "practice",
      "confidence": "mainstream",
      "caveat": "Practical guidance used in many feedback approaches."
    },
    {
      "id": "F6",
      "statement": "Describing the effect of the action on others or on the work helps the receiver understand why it matters, for example 'the room looked at their phones while you read'.",
      "kind": "practice",
      "confidence": "mainstream",
      "caveat": "Effects should be ones you actually saw or can reasonably state as your own experience; do not present guesses as fact."
    },
    {
      "id": "F7",
      "statement": "Describing the effect in terms of your own experience or what you observed is harder to dispute than a verdict on the person.",
      "kind": "practice",
      "confidence": "mainstream",
      "caveat": "Common coaching advice, not a guarantee the receiver will not feel defensive."
    },
    {
      "id": "F8",
      "statement": "A clear next step names one concrete thing the person can do next time, such as 'next week, open with the one decision you need from us'.",
      "kind": "practice",
      "confidence": "mainstream",
      "caveat": "Practical guidance; the step works best when the receiver agrees it is doable."
    },
    {
      "id": "F9",
      "statement": "Feedback that includes an action, its effect and a next step is more actionable than a comment that has only a feeling or a judgement.",
      "kind": "practice",
      "confidence": "mainstream",
      "caveat": "Present as a practical structure many organisations teach under different names, not as the result of one study."
    },
    {
      "id": "F10",
      "statement": "Before saying feedback, you can check a draft by asking: could someone have seen or heard the action, is the effect stated, and could the receiver do the next step tomorrow?",
      "kind": "practice",
      "confidence": "mainstream",
      "caveat": "This checklist is a practical tool derived from the three parts, not a validated instrument."
    },
    {
      "id": "F11",
      "statement": "Feedback delivered soon after the event is easier for both people to recall accurately than feedback delivered long afterwards.",
      "kind": "practice",
      "confidence": "mainstream",
      "caveat": "Direction only; there are cases where waiting for a calmer moment is wiser."
    },
    {
      "id": "F12",
      "statement": "A receiver can be warm and agreeable in the moment and still change nothing if the feedback gave them no specific action to take.",
      "kind": "caution",
      "confidence": "mainstream",
      "caveat": "Common observation in practice, not a measured rate."
    }
  ],
  "not_claimed": [
    "No percentage or ratio of positive to negative comments is claimed.",
    "No claim that a specific number of seconds or minutes makes feedback work.",
    "No learning-styles claims.",
    "No claim that one named feedback model is the correct one; the three parts are a practical structure taught under various names.",
    "No claim that following the three parts guarantees behaviour change or removes defensiveness.",
    "No invented quotes or sayings attributed to real people.",
    "No claim that praise is bad; the point is that it is not specific."
  ],
  "review": {
    "status": "approved",
    "by": "agent, unattended per Kshitij (Relay vs Shuttle comparison, Opus on the storyboard only, 2026-10-08)",
    "note": "Written without source documents; all facts are practice-level guidance graded conservatively. Open question on a named model left unanswered on purpose: no model is anchored."
  }
}
