{
  "topic": "How to give feedback that changes behaviour, not just feelings",
  "scope_note": "Peer and manager feedback in workplaces: why vague feedback fails, and the behaviour, effect, next step shape. No statistics. Not tied to any one named model.",
  "facts": [
    {
      "id": "F1",
      "statement": "Feedback is information given to a person about their actions and what those actions led to, so they can keep or change what they do.",
      "kind": "definition",
      "confidence": "established"
    },
    {
      "id": "F2",
      "statement": "Vague feedback such as 'good job' or 'you need to be more engaged' gives the receiver nothing specific to repeat or change.",
      "kind": "mechanism",
      "confidence": "mainstream",
      "caveat": "This is a widely taught practical principle rather than a single proven law; say 'tends to' rather than 'always'."
    },
    {
      "id": "F3",
      "statement": "Warm, general praise can make the receiver feel good without telling them which action to keep doing.",
      "kind": "mechanism",
      "confidence": "mainstream",
      "caveat": "Praise can still support the relationship; the point is that it alone rarely guides behaviour."
    },
    {
      "id": "F4",
      "statement": "Feedback is easier to act on when it describes a specific behaviour that was observed, such as what the person said or did in a particular situation.",
      "kind": "practice",
      "confidence": "mainstream",
      "caveat": "Based on broad practitioner consensus and research on feedback specificity; effects vary by person and context."
    },
    {
      "id": "F5",
      "statement": "A behaviour is something that could be seen or heard, while a label such as 'careless' or 'negative' is a judgement about the person.",
      "kind": "definition",
      "confidence": "established"
    },
    {
      "id": "F6",
      "statement": "Feedback aimed at a person's character or personality is more likely to trigger defensiveness than feedback aimed at a specific action.",
      "kind": "mechanism",
      "confidence": "mainstream",
      "caveat": "Say 'is more likely to'; individuals differ and the relationship matters."
    },
    {
      "id": "F7",
      "statement": "Describing the effect of a behaviour on other people or on the work shows the receiver why it matters.",
      "kind": "practice",
      "confidence": "mainstream",
      "caveat": "Practitioner consensus; the effect should be one that actually occurred, not a guess."
    },
    {
      "id": "F8",
      "statement": "The effect should be stated as what happened, for example a decision delayed or a colleague unable to finish a point, rather than as an assumption about the person's motives.",
      "kind": "caution",
      "confidence": "mainstream",
      "caveat": "Motives are often unknown to the giver, so naming them risks being wrong and prompting defensiveness."
    },
    {
      "id": "F9",
      "statement": "Feedback that ends with one concrete next step gives the receiver something specific to try instead of only something to feel.",
      "kind": "practice",
      "confidence": "mainstream",
      "caveat": "Practitioner consensus; the step works best when agreed with the person rather than imposed."
    },
    {
      "id": "F10",
      "statement": "One small next step is easier to act on than a long list of changes.",
      "kind": "practice",
      "confidence": "mainstream",
      "caveat": "Common practical guidance; no specific number of items is established."
    },
    {
      "id": "F11",
      "statement": "Feedback is more useful when given reasonably soon after the behaviour, while both people can recall the situation.",
      "kind": "practice",
      "confidence": "mainstream",
      "caveat": "No exact time window is established; 'soon' depends on the situation."
    },
    {
      "id": "F12",
      "statement": "Asking the receiver for their view of the situation lets the giver check their reading and helps agree a next step the receiver will own.",
      "kind": "practice",
      "confidence": "mainstream",
      "caveat": "Practitioner consensus rather than a tested rule."
    },
    {
      "id": "F13",
      "statement": "Behaviour, effect and next step is one useful way to structure feedback; other structures exist and can also work.",
      "kind": "caution",
      "confidence": "established"
    },
    {
      "id": "F14",
      "statement": "A rewrite can be checked by asking whether it names something observable, states a real effect, and offers one step the person could try.",
      "kind": "practice",
      "confidence": "mainstream",
      "caveat": "A practical test, not a validated scoring instrument."
    }
  ],
  "not_claimed": [
    "Any percentage or statistic about how much feedback improves performance or how much people forget",
    "Learning-styles claims, such as people being visual or auditory learners and needing feedback matched to that",
    "A fixed ratio of praise to criticism that guarantees results",
    "The 'feedback sandwich' is not claimed to be proven best",
    "Made-up sayings or quotes attributed to researchers or famous leaders",
    "That one named feedback model is the only valid one",
    "That specific feedback guarantees behaviour change; it only makes change easier"
  ],
  "review": {
    "status": "approved",
    "by": "agent, unattended per Kshitij (verification run after the D-143 fixes, 2026-10-08)",
    "note": "No numbers or named studies included. Confidence graded conservatively; nothing was verified against external sources in this run."
  }
}
