{
  "topic": "How to give feedback that changes behaviour, not just feelings",
  "scope_note": "Practical guidance on structuring a single feedback comment so the receiver knows what to do differently. Does not cover formal performance review systems, disciplinary process, or written documentation requirements.",
  "facts": [
    {
      "id": "F1",
      "statement": "Feedback that names a feeling or a character judgement about the person rarely tells them what to repeat or stop doing",
      "kind": "finding",
      "confidence": "mainstream",
      "caveat": "This is a widely taught practitioner principle in feedback and coaching literature rather than a single settled experimental finding."
    },
    {
      "id": "F2",
      "statement": "A behaviour is something that was directly seen or heard, such as a specific action or word choice, not an inference about intent or character",
      "kind": "definition",
      "confidence": "established"
    },
    {
      "id": "F3",
      "statement": "Naming a specific observed behaviour gives the other person something concrete they can recognise in themselves",
      "kind": "mechanism",
      "confidence": "mainstream",
      "caveat": "The mechanism is plausible and widely taught, though the sheet does not cite a controlled study showing the size of the effect."
    },
    {
      "id": "F4",
      "statement": "Labels like unprofessional or careless describe a judgement, not a behaviour, so they leave the person guessing what action caused the label",
      "kind": "example",
      "confidence": "mainstream"
    },
    {
      "id": "F5",
      "statement": "Connecting a behaviour to its concrete impact on the work, team or outcome gives the person a reason to change it",
      "kind": "practice",
      "confidence": "mainstream",
      "caveat": "This is standard coaching practice; it is not claimed to be sufficient on its own without a clear next step."
    },
    {
      "id": "F6",
      "statement": "A feedback comment that stops at an opinion, such as this needs to be better, does not tell the person what action to take next",
      "kind": "finding",
      "confidence": "mainstream"
    },
    {
      "id": "F7",
      "statement": "Ending a feedback conversation with a clear, agreed next action makes it more likely the person's behaviour changes than ending with an opinion alone",
      "kind": "practice",
      "confidence": "mainstream",
      "caveat": "Widely taught in coaching and management practice; the sheet does not cite a controlled comparison of outcomes."
    },
    {
      "id": "F8",
      "statement": "A next action is concrete when the person could start it within the same week without needing further clarification",
      "kind": "definition",
      "confidence": "mainstream"
    },
    {
      "id": "F9",
      "statement": "Asking the other person for their view before fixing the next step increases the chance they agree with it and follow through",
      "kind": "practice",
      "confidence": "mainstream",
      "caveat": "This reflects common coaching guidance on collaborative goal setting rather than a single cited study."
    },
    {
      "id": "F10",
      "statement": "A next step that the person helped shape is more likely to be one they actually attempt than one handed to them",
      "kind": "mechanism",
      "confidence": "mainstream",
      "caveat": "Plausible and widely taught, not backed here by a specific named study."
    },
    {
      "id": "F11",
      "statement": "The three parts of a behaviour-based feedback comment are the specific behaviour observed, its impact, and the agreed next step",
      "kind": "definition",
      "confidence": "mainstream",
      "caveat": "This three-part structure is a common practitioner framework, presented here as a useful shape rather than a single validated model with a named origin."
    },
    {
      "id": "F12",
      "statement": "Feedback can flow between peers or from a more junior person to a more senior one, not only from a manager down to a report",
      "kind": "definition",
      "confidence": "established"
    },
    {
      "id": "F13",
      "statement": "A tone that is warm or blunt in delivery does not by itself determine whether the receiver's behaviour changes afterward",
      "kind": "finding",
      "confidence": "mainstream",
      "caveat": "This reflects the practitioner view that clarity of the message matters more than delivery style; it is not a claim that tone never matters."
    },
    {
      "id": "F14",
      "statement": "A vague comment can be rewritten by adding the missing behaviour, impact or next step without needing a new conversation",
      "kind": "practice",
      "confidence": "mainstream"
    }
  ],
  "not_claimed": [
    "There is no fixed statistic for how much feedback changes behaviour or how often vague feedback fails",
    "No specific named feedback model (such as a particular branded framework) is established fact; the behaviour, impact, next-step shape here is a generic practitioner pattern",
    "Learning-styles or modality-matching claims are not supported and are not part of this topic",
    "Harsh or blunt delivery is not claimed to be more effective than warm delivery, nor is warmth claimed to be sufficient on its own",
    "Feedback is not claimed to work only when given by a manager to a direct report"
  ],
  "review": {
    "status": "approved",
    "by": "agent, unattended per Kshitij (Relay vs Shuttle comparison, 2026-10-08)",
    "note": ""
  }
}
